{
  "protocol_version": "1.0",
  "request_id": "11111111-1111-4111-8111-111111111111",
  "device_id": null,
  "capability": "device.status",
  "arguments": {},
  "actor": { "id": "test-client", "kind": "ai_client" },
  "session_id": "session-test",
  "response_mode": "compact",
  "idempotency_key": null,
  "preconditions": [],
  "expectations": []
}
